{
  "$schema": "https://json-schema.org/draft/2020-12/schema",
  "$id": "https://github.com/CCX39/pcv-stage2-allocation/schemas/stage2_result.schema.json",
  "title": "Stage2 MVP Result",
  "description": "Draft schema for future Stage2 solver output. This schema describes output format only and does not indicate that a solver exists.",
  "type": "object",
  "additionalProperties": false,
  "required": [
    "schema_version",
    "scenario_id",
    "status",
    "budget_total_bytes",
    "b_min_feasible",
    "budget_gap",
    "total_bytes",
    "total_net_utility",
    "total_spatial_utility",
    "total_decode_ms",
    "budget_utilization",
    "selected_tiles",
    "lookup_resolution",
    "lambda_search",
    "runtime_ms",
    "config_snapshot",
    "warnings",
    "errors"
  ],
  "properties": {
    "schema_version": {
      "type": "string",
      "minLength": 1
    },
    "scenario_id": {
      "type": "string",
      "minLength": 1
    },
    "status": {
      "type": "string",
      "enum": [
        "SUCCESS",
        "INFEASIBLE_BUDGET",
        "INVALID_INPUT",
        "INVALID_LOOKUP",
        "NO_ALLOWED_LEVEL",
        "NUMERICAL_ERROR",
        "INTERNAL_CONSTRAINT_VIOLATION"
      ]
    },
    "budget_total_bytes": {
      "type": "number",
      "minimum": 0
    },
    "b_min_feasible": {
      "type": [
        "number",
        "null"
      ],
      "minimum": 0
    },
    "budget_gap": {
      "type": [
        "number",
        "null"
      ]
    },
    "total_bytes": {
      "type": [
        "number",
        "null"
      ],
      "minimum": 0
    },
    "total_net_utility": {
      "type": [
        "number",
        "null"
      ]
    },
    "total_spatial_utility": {
      "type": [
        "number",
        "null"
      ]
    },
    "total_decode_ms": {
      "type": [
        "number",
        "null"
      ],
      "minimum": 0
    },
    "budget_utilization": {
      "type": [
        "number",
        "null"
      ],
      "minimum": 0
    },
    "selected_tiles": {
      "type": "array",
      "items": {
        "$ref": "#/$defs/selectedTile"
      }
    },
    "lookup_resolution": {
      "type": "array",
      "items": {
        "$ref": "#/$defs/lookupResolution"
      }
    },
    "lambda_search": {
      "$ref": "#/$defs/lambdaSearch"
    },
    "runtime_ms": {
      "type": [
        "number",
        "null"
      ],
      "minimum": 0
    },
    "config_snapshot": {
      "type": "object",
      "additionalProperties": true
    },
    "warnings": {
      "type": "array",
      "items": {
        "$ref": "#/$defs/message"
      }
    },
    "errors": {
      "type": "array",
      "items": {
        "$ref": "#/$defs/message"
      }
    }
  },
  "$defs": {
    "selectedTile": {
      "type": "object",
      "additionalProperties": false,
      "required": [
        "tile_id",
        "selected_level_id",
        "r_bytes",
        "d_ms",
        "net_utility",
        "spatial_utility",
        "allowed_levels"
      ],
      "properties": {
        "tile_id": {
          "type": "string",
          "minLength": 1
        },
        "selected_level_id": {
          "type": [
            "integer",
            "null"
          ],
          "minimum": 1
        },
        "r_bytes": {
          "type": [
            "number",
            "null"
          ],
          "minimum": 0
        },
        "d_ms": {
          "type": [
            "number",
            "null"
          ],
          "minimum": 0
        },
        "net_utility": {
          "type": [
            "number",
            "null"
          ]
        },
        "spatial_utility": {
          "type": [
            "number",
            "null"
          ]
        },
        "allowed_levels": {
          "type": "array",
          "items": {
            "type": "integer",
            "minimum": 1
          }
        }
      }
    },
    "lookupResolution": {
      "type": "object",
      "additionalProperties": false,
      "required": [
        "tile_id",
        "lookup_profile_id",
        "lookup_level",
        "allowed_levels"
      ],
      "properties": {
        "tile_id": {
          "type": "string",
          "minLength": 1
        },
        "lookup_profile_id": {
          "type": "string",
          "minLength": 1
        },
        "matched_rule_id": {
          "type": [
            "string",
            "null"
          ]
        },
        "lookup_level": {
          "type": [
            "integer",
            "null"
          ],
          "minimum": 1
        },
        "allowed_levels": {
          "type": "array",
          "items": {
            "type": "integer",
            "minimum": 1
          }
        }
      }
    },
    "lambdaSearch": {
      "type": "object",
      "additionalProperties": false,
      "required": [
        "enabled",
        "lambda_initial_high",
        "lambda_max_bracket_steps",
        "score_epsilon",
        "lambda_epsilon",
        "max_iterations",
        "iterations",
        "best_feasible_iteration"
      ],
      "properties": {
        "enabled": {
          "type": "boolean"
        },
        "lambda_initial_high": {
          "type": [
            "number",
            "null"
          ],
          "exclusiveMinimum": 0
        },
        "lambda_max_bracket_steps": {
          "type": [
            "integer",
            "null"
          ],
          "minimum": 0
        },
        "score_epsilon": {
          "type": [
            "number",
            "null"
          ],
          "minimum": 0
        },
        "lambda_epsilon": {
          "type": [
            "number",
            "null"
          ],
          "minimum": 0
        },
        "max_iterations": {
          "type": [
            "integer",
            "null"
          ],
          "minimum": 0
        },
        "iterations": {
          "type": "array",
          "items": {
            "$ref": "#/$defs/lambdaIteration"
          }
        },
        "best_feasible_iteration": {
          "type": [
            "integer",
            "null"
          ],
          "minimum": 0
        }
      }
    },
    "lambdaIteration": {
      "type": "object",
      "additionalProperties": false,
      "required": [
        "iteration",
        "lambda",
        "total_bytes",
        "total_net_utility",
        "is_budget_feasible"
      ],
      "properties": {
        "iteration": {
          "type": "integer",
          "minimum": 0
        },
        "lambda": {
          "type": "number",
          "minimum": 0
        },
        "total_bytes": {
          "type": "number",
          "minimum": 0
        },
        "total_net_utility": {
          "type": "number"
        },
        "is_budget_feasible": {
          "type": "boolean"
        }
      }
    },
    "message": {
      "type": "object",
      "additionalProperties": false,
      "required": [
        "code",
        "message"
      ],
      "properties": {
        "code": {
          "type": "string",
          "minLength": 1
        },
        "message": {
          "type": "string",
          "minLength": 1
        },
        "details": {
          "type": "object",
          "additionalProperties": true
        }
      }
    }
  }
}
